{
  "$schema": "https://json-schema.org/draft/2020-12/schema",
  "$id": "https://spec.stoked.tech/schemas/common/block.json",
  "title": "Semantic Block",
  "description": "Schema for semantic content block",
  "type": "object",
  "properties": {
    "type": {
      "type": "string",
      "description": "Type of semantic block",
      "pattern": "^sps:block/[a-zA-Z0-9-_]+$"
    },
    "id": {
      "type": "string",
      "description": "Unique identifier for the block",
      "pattern": "^block:[a-zA-Z0-9-_]+$"
    },
    "title": {
      "type": "string",
      "description": "Title of the content block"
    },
    "author": {
      "type": "string",
      "description": "Author identifier",
      "pattern": "^user:[a-zA-Z0-9._-]+$"
    },
    "created": {
      "type": "string",
      "format": "date-time",
      "description": "Creation timestamp in ISO 8601 format"
    },
    "modified": {
      "type": "string",
      "format": "date-time",
      "description": "Last modification timestamp in ISO 8601 format"
    },
    "tags": {
      "type": "array",
      "description": "Tags associated with the block",
      "items": {
        "type": "string"
      }
    },
    "payload": {
      "type": "object",
      "description": "The actual content payload - structure varies by block type"
    }
  },
  "required": ["type", "id", "title", "author", "created"],
  "additionalProperties": false
}